{"grao":"1 linha por período × subconjunto de segmentos × departamento","dimensoes":{"periodo":["4s","13s","26s","base"],"subconjunto":["todos","Fiéis","Regulares","Fiéis+Regulares","Esporádicos","Fiéis+Esporádicos","Regulares+Esporádicos","Fiéis+Regulares+Esporádicos","Em pausa","Fiéis+Em pausa","Regulares+Em pausa","Fiéis+Regulares+Em pausa","Esporádicos+Em pausa","Fiéis+Esporádicos+Em pausa","Regulares+Esporádicos+Em pausa","Fiéis+Regulares+Esporádicos+Em pausa"],"departamento":["todos","AUTOMOTIVE","CHEF SHOPPE","COSMETICS","DELI","DELI/SNACK BAR","DRUG GM","FLORAL","FROZEN GROCERY","GROCERY","MEAT","MEAT-PCKGD","NUTRITION","PASTRY","PHOTO","POSTAL CENTER","PRODUCE","RESTAURANT","RX","SALAD BAR","SEAFOOD","SEAFOOD-PCKGD","SPIRITS","TRAVEL & LEISUR","VIDEO","DAIRY DELI","GARDEN CENTER","TOYS","GM MERCH EXP","HBC","MEAT-WHSE","PORK","CHARITABLE CONT","ELECT &PLUMBING","GRO BAKERY","HOUSEWARES","PROD-WHS SALES","VIDEO RENTAL"]},"colunas":["periodo","subconjunto","departamento","cestas","cestas_comparavel","cestas_ano_anterior","cestas_variacao_pct","ticket_medio","ticket_medio_comparavel","ticket_medio_ano_anterior","ticket_medio_variacao_pct","itens_por_cesta","itens_por_cesta_comparavel","itens_por_cesta_ano_anterior","itens_por_cesta_variacao_pct","clientes_ativos","clientes_ativos_comparavel","clientes_ativos_ano_anterior","clientes_ativos_variacao_pct","lojas_comparaveis","amostra_pequena"],"linhas":[[0,0,0,10276,9762,10283,-0.0507,33.97,33.67,30.5,0.1038,14.863,14.7803,13.9116,0.0624,2205,2205,2138,0.0313,123,false],[0,0,1,4,4,1,3.0,3.61,3.61,3.5,0.03,1.0,1.0,1.0,0.0,6,6,8,-0.25,123,true],[0,0,2,59,58,4,13.5,3.65,3.63,2.99,0.2134,1.2373,1.2241,1.0,0.2241,77,77,4,18.25,123,true],[0,0,3,229,222,220,0.0091,6.55,6.47,6.4,0.0111,1.4978,1.5,1.5636,-0.0407,333,333,328,0.0152,123,false],[0,0,4,1572,1479,1452,0.0186,7.64,7.5,7.06,0.0617,1.9071,1.8911,1.8926,-0.0007,1163,1163,1038,0.1204,123,false],[0,0,5,1,1,0,null,3.99,3.99,null,null,1.0,1.0,null,null,2,2,0,null,123,true],[0,0,6,5215,4924,5063,-0.0275,9.6,9.43,9.21,0.0243,3.1555,3.1219,3.1776,-0.0175,1940,1940,1861,0.0425,123,false],[0,0,7,207,196,182,0.0769,15.27,15.23,12.88,0.1822,1.3575,1.352,1.3516,0.0003,260,260,255,0.0196,123,false],[0,0,8,21,16,7,1.2857,2.41,2.14,4.45,-0.5197,1.0952,1.0625,1.4286,-0.2563,35,35,17,1.0588,123,true],[0,0,9,8945,8512,8815,-0.0344,21.91,21.77,19.76,0.1014,11.3601,11.3066,10.6091,0.0658,2158,2158,2098,0.0286,123,false],[0,0,10,2407,2296,2215,0.0366,9.86,9.78,10.25,-0.0457,2.1778,2.1668,2.2781,-0.0489,1489,1489,1401,0.0628,123,false],[0,0,11,2558,2429,2420,0.0037,7.22,7.21,7.2,0.0013,2.4621,2.4586,2.4831,-0.0098,1580,1580,1524,0.0367,123,false],[0,0,12,822,764,696,0.0977,6.52,6.4,5.93,0.08,2.8759,2.8037,2.5144,0.1151,667,667,616,0.0828,123,false],[0,0,13,1335,1269,1206,0.0522,4.16,4.15,4.0,0.0365,1.6801,1.6761,1.5978,0.049,1098,1098,1026,0.0702,123,false],[0,0,14,1,1,0,null,2.49,2.49,null,null,1.0,1.0,null,null,1,1,0,null,123,true],[0,0,15,9,9,0,null,0.48,0.48,null,null,1.4444,1.4444,null,null,6,6,0,null,123,true],[0,0,16,3771,3584,3755,-0.0455,6.68,6.62,6.1,0.0853,3.4866,3.4682,3.6929,-0.0609,1773,1773,1741,0.0184,123,false],[0,0,17,26,23,8,1.875,7.43,6.91,5.3,0.304,1.1538,1.1304,1.25,-0.0957,32,32,18,0.7778,123,true],[0,0,18,2,1,0,null,13.44,20.89,null,null,1.0,1.0,null,null,4,4,0,null,123,true],[0,0,19,371,343,404,-0.151,3.91,4.01,3.78,0.059,1.2318,1.2478,1.2624,-0.0115,315,315,332,-0.0512,123,false],[0,0,20,180,164,160,0.025,9.56,9.06,7.61,0.1913,1.3556,1.372,1.2625,0.0867,217,217,187,0.1604,123,false],[0,0,21,485,458,417,0.0983,7.03,7.05,6.97,0.0112,1.5588,1.5502,1.5564,-0.0039,582,582,522,0.1149,123,false],[0,0,22,89,86,80,0.075,10.56,10.58,12.49,-0.1531,1.1798,1.186,1.2375,-0.0416,78,78,82,-0.0488,123,true],[0,0,23,32,29,23,0.2609,3.43,3.43,2.98,0.1495,1.0,1.0,1.0435,-0.0417,40,40,42,-0.0476,123,true],[0,0,24,2,2,0,null,10.99,10.99,null,null,1.0,1.0,null,null,2,2,0,null,123,true],[0,1,0,7129,6787,6521,0.0408,34.7,34.41,31.37,0.097,15.0706,15.0357,14.1009,0.0663,857,857,830,0.0325,123,false],[0,1,1,3,3,1,2.0,2.82,2.82,3.5,-0.1933,1.0,1.0,1.0,0.0,4,4,4,0.0,123,true],[0,1,2,47,46,3,14.3333,3.62,3.59,2.99,0.2001,1.234,1.2174,1.0,0.2174,56,56,3,17.6667,123,true],[0,1,3,171,167,150,0.1133,6.89,6.84,6.43,0.0636,1.5439,1.5509,1.5133,0.0248,228,228,206,0.1068,123,false],[0,1,4,1100,1036,1002,0.0339,7.88,7.71,7.06,0.0911,1.9436,1.9286,1.9192,0.0049,629,629,574,0.0958,123,false],[0,1,5,0,0,0,null,null,null,null,null,null,null,null,null,1,1,0,null,123,true],[0,1,6,3747,3548,3310,0.0719,9.83,9.66,9.52,0.0155,3.2239,3.2077,3.2885,-0.0246,849,849,801,0.0599,123,false],[0,1,7,131,125,109,0.1468,14.78,14.73,13.4,0.0992,1.313,1.304,1.4862,-0.1226,163,163,143,0.1399,123,false],[0,1,8,17,13,6,1.1667,2.63,2.31,4.54,-0.4917,1.1176,1.0769,1.5,-0.2821,24,24,13,0.8462,123,true],[0,1,9,6207,5922,5604,0.0567,22.15,22.03,20.17,0.0923,11.3978,11.3771,10.5971,0.0736,856,856,829,0.0326,123,false],[0,1,10,1670,1597,1418,0.1262,9.75,9.65,10.29,-0.0625,2.1497,2.1384,2.2355,-0.0435,748,748,684,0.0936,123,false],[0,1,11,1774,1689,1534,0.101,7.24,7.2,6.91,0.043,2.4504,2.4381,2.3631,0.0317,782,782,727,0.0757,123,false],[0,1,12,586,549,460,0.1935,6.79,6.71,6.14,0.0925,2.8618,2.8579,2.5957,0.101,400,400,351,0.1396,123,false],[0,1,13,927,885,762,0.1614,3.96,3.98,3.79,0.0509,1.6472,1.6418,1.5591,0.0531,601,601,523,0.1491,123,false],[0,1,14,1,1,0,null,2.49,2.49,null,null,1.0,1.0,null,null,1,1,0,null,123,true],[0,1,15,6,6,0,null,0.39,0.39,null,null,1.1667,1.1667,null,null,4,4,0,null,123,true],[0,1,16,2647,2529,2388,0.059,6.96,6.89,6.35,0.0859,3.6267,3.6006,3.8626,-0.0678,818,818,777,0.0528,123,false],[0,1,17,21,18,5,2.6,7.85,7.26,6.58,0.1034,1.1429,1.1111,1.2,-0.0741,23,23,12,0.9167,123,true],[0,1,18,2,1,0,null,13.44,20.89,null,null,1.0,1.0,null,null,3,3,0,null,123,true],[0,1,19,282,257,255,0.0078,3.81,3.92,3.81,0.0269,1.2234,1.2412,1.2588,-0.014,191,191,177,0.0791,123,false],[0,1,20,137,126,115,0.0957,9.62,9.09,8.04,0.1313,1.3869,1.3968,1.2783,0.0928,143,143,119,0.2017,123,false],[0,1,21,336,317,253,0.253,7.42,7.45,7.06,0.0552,1.619,1.6151,1.5771,0.0241,341,341,298,0.1443,123,false],[0,1,22,68,68,53,0.283,10.26,10.26,13.17,-0.2214,1.2059,1.2059,1.2642,-0.0461,48,48,47,0.0213,123,true],[0,1,23,20,17,14,0.2143,3.74,3.79,3.27,0.1595,1.0,1.0,1.0714,-0.0667,20,20,23,-0.1304,123,true],[0,1,24,2,2,0,null,10.99,10.99,null,null,1.0,1.0,null,null,2,2,0,null,123,true],[0,2,0,2781,2631,2954,-0.1093,33.86,33.48,29.4,0.1387,15.0521,14.8521,13.8389,0.0732,966,966,870,0.1103,123,false],[0,2,1,1,1,0,null,5.95,5.95,null,null,1.0,1.0,null,null,2,2,2,0.0,123,true],[0,2,2,12,12,1,11.0,3.78,3.78,2.99,0.2642,1.25,1.25,1.0,0.25,17,17,1,16.0,123,true],[0,2,3,51,48,55,-0.1273,5.59,5.41,6.04,-0.1044,1.3137,1.2917,1.7455,-0.26,94,94,101,-0.0693,123,true],[0,2,4,433,406,369,0.1003,7.06,7.05,6.95,0.0156,1.8222,1.8227,1.8591,-0.0196,454,454,350,0.2971,123,false],[0,2,6,1314,1235,1409,-0.1235,9.11,8.89,8.32,0.069,2.9939,2.9085,2.983,-0.025,854,854,757,0.1281,123,false],[0,2,7,64,61,57,0.0702,16.65,16.36,11.65,0.4042,1.4063,1.3934,1.1404,0.2219,76,76,89,-0.1461,123,true],[0,2,8,4,3,1,2.0,1.48,1.41,3.94,-0.6421,1.0,1.0,1.0,0.0,11,11,3,2.6667,123,true],[0,2,9,2451,2319,2533,-0.0845,22.21,22.03,19.24,0.1446,11.6744,11.5455,10.7319,0.0758,958,958,861,0.1127,123,false],[0,2,10,674,640,646,-0.0093,10.36,10.32,10.23,0.0094,2.2819,2.2703,2.3452,-0.0319,622,622,542,0.1476,123,false],[0,2,11,724,684,705,-0.0298,7.21,7.25,7.67,-0.0545,2.4834,2.5,2.6638,-0.0615,668,668,601,0.1115,123,false],[0,2,12,217,199,193,0.0311,6.0,5.72,5.49,0.0427,3.0184,2.7387,2.2487,0.2179,230,230,213,0.0798,123,false],[0,2,13,362,340,368,-0.0761,4.46,4.47,4.29,0.0419,1.7707,1.7706,1.663,0.0647,419,419,387,0.0827,123,false],[0,2,15,2,2,0,null,0.83,0.83,null,null,2.5,2.5,null,null,1,1,0,null,123,true],[0,2,16,1038,976,1104,-0.1159,6.1,6.08,5.77,0.0523,3.1975,3.1998,3.4212,-0.0647,771,771,703,0.0967,123,false],[0,2,17,5,5,3,0.6667,5.66,5.66,3.17,0.7861,1.2,1.2,1.3333,-0.1,9,9,6,0.5,123,true],[0,2,18,0,0,0,null,null,null,null,null,null,null,null,null,1,1,0,null,123,true],[0,2,19,83,80,123,-0.3496,4.34,4.39,3.65,0.2013,1.2771,1.2875,1.2358,0.0419,108,108,111,-0.027,123,true],[0,2,20,40,35,36,-0.0278,9.21,8.77,6.85,0.2793,1.275,1.3143,1.2778,0.0286,65,65,53,0.2264,123,true],[0,2,21,136,129,130,-0.0077,6.25,6.23,6.99,-0.1094,1.4338,1.4109,1.5308,-0.0783,210,210,177,0.1864,123,false],[0,2,22,19,16,16,0.0,10.97,11.15,10.98,0.0161,1.0526,1.0625,1.25,-0.15,27,27,23,0.1739,123,true],[0,2,23,12,12,7,0.7143,2.91,2.91,2.34,0.2425,1.0,1.0,1.0,0.0,19,19,17,0.1176,123,true],[0,3,0,9910,9418,9475,-0.006,34.46,34.15,30.76,0.1104,15.0654,14.9844,14.0192,0.0688,1823,1823,1700,0.0724,123,false],[0,3,1,4,4,1,3.0,3.61,3.61,3.5,0.03,1.0,1.0,1.0,0.0,6,6,6,0.0,123,true],[0,3,2,59,58,4,13.5,3.65,3.63,2.99,0.2134,1.2373,1.2241,1.0,0.2241,73,73,4,17.25,123,true],[0,3,3,222,215,205,0.0488,6.59,6.52,6.32,0.0308,1.491,1.493,1.5756,-0.0524,322,322,307,0.0489,123,false],[0,3,4,1533,1442,1371,0.0518,7.65,7.52,7.03,0.0699,1.9093,1.8988,1.903,-0.0022,1083,1083,924,0.1721,123,false],[0,3,5,0,0,0,null,null,null,null,null,null,null,null,null,1,1,0,null,123,true],[0,3,6,5061,4783,4719,0.0136,9.64,9.46,9.16,0.0334,3.1642,3.1305,3.1973,-0.0209,1703,1703,1558,0.0931,123,false],[0,3,7,195,186,166,0.1205,15.4,15.26,12.8,0.1926,1.3436,1.3333,1.3675,-0.025,239,239,232,0.0302,123,false],[0,3,8,21,16,7,1.2857,2.41,2.14,4.45,-0.5197,1.0952,1.0625,1.4286,-0.2563,35,35,16,1.1875,123,true],[0,3,9,8658,8241,8137,0.0128,22.17,22.03,19.88,0.108,11.4761,11.4245,10.6391,0.0738,1814,1814,1690,0.0734,123,false],[0,3,10,2344,2237,2064,0.0838,9.92,9.84,10.27,-0.0418,2.1877,2.1761,2.2699,-0.0413,1370,1370,1226,0.1175,123,false],[0,3,11,2498,2373,2239,0.0598,7.23,7.22,7.15,0.0099,2.46,2.456,2.4578,-0.0007,1450,1450,1328,0.0919,123,false],[0,3,12,803,748,653,0.1455,6.58,6.44,5.95,0.0838,2.9041,2.8262,2.4931,0.1336,630,630,564,0.117,123,false],[0,3,13,1289,1225,1130,0.0841,4.1,4.12,3.95,0.0418,1.6